<?xml version="1.0" encoding="UTF-8"?>
<!DOCTYPE Web SYSTEM "Dtdfile.dtd" >
<Web>
  <GOOGLE>
    <TWITTER>TWITTER</TWITTER>
    <GAMES>GAMES</GAMES>
    <JAVATPOINT>JAVATPOINT</JAVATPOINT>
    <FLIPCART>FLIPCART</FLIPCART>
    <SNAPDEAL>SNAPDEAL</SNAPDEAL>
  </GOOGLE>
  <GMAIL>
    <INBOX>INBOX</INBOX>
    <COMPOSEMAIL>COMPOSEMAIL</COMPOSEMAIL>
    <TRASH>TRASH</TRASH>
    <SPAM>SPAM</SPAM>
  </GMAIL>
  <FB>
    <HOME>HOME</HOME>
    <PROFILE>PROFILE</PROFILE>
    <MESSAGE>MESSAGE</MESSAGE>
    "WebContent/WEB-INF/XMLFORDTD.xml"<LOGIN>LOGIN</LOGIN>
  </FB>
</Web>
